{"finding_id":"PPR-FND-EXAMPLE-001","skill_id":"PPR-03","baseline_id":"PPR-BL-EXAMPLE-001","proof_id":"proof-v1","location":{"locator":"p.12 para 2","page":12,"object_id":null,"format":"pdf"},"defect_type":"typesetter_error","severity":"high","current_state":"The results support stated limitation.","expected_state":"The results support the stated limitation.","evidence":["approved.docx:p12","proof.pdf:p12"],"authority":"PPR-TEXT-001","correction_instruction":"Insert 'the' at p.12 para 2.","owner":"production owner","status":"reproof_required","impact":"meaning","confidence":"high","release_effect":"hold","correction_id":"COR-EXAMPLE-001","created_at":"2026-08-14T00:00:00Z","updated_at":"2026-08-14T00:00:00Z"}
